<?xml version="1.0" encoding="utf-8"?>
<gadgetronStreamConfiguration xsi:schemaLocation="http://gadgetron.sf.net/gadgetron gadgetron.xsd"
        xmlns="http://gadgetron.sf.net/gadgetron"
        xmlns:xsi="http://www.w3.org/2001/XMLSchema-instance">

    <!-- 
        GT Plus configuratin file for 2DT cartesian reconstruction on GtPlus Cloud
        This configuration file configures one gadget to perform the reconstruction for
        2DT job packages

        Depending on the incoming algorithm parameters, both linear and non-linear reconstruction
        can be performed

        Author: Hui Xue
        Magnetic Resonance Technology Program
        National Heart, Lung and Blood Institute
        National Institutes of Health
        10 Center Drive, Bethesda
        MD 20814
        USA
        Email: hui.xue@nih.gov
    -->

    <!-- reader -->
    <reader>
        <slot>1013</slot>
        <dll>gadgetronPlus</dll>
        <classname>GtPlusCloudJobMessageReaderCPFL</classname>
    </reader>

    <!-- writer -->
    <writer>
        <slot>1013</slot>
        <dll>gadgetronPlus</dll>
        <classname>GtPlusCloudJobMessageWriterCPFL</classname>
    </writer>

    <!--
    Recon computation for 2DT/3DT cases, process one job
    a gtPlusReconJob2DT job consists of kspace, kernel and parameters
    kspace: [RO E1 CHA E2/PHS]
    -->

    <gadget>
        <name>Recon</name>
        <dll>gadgetronPlus</dll>
        <classname>GtPlusReconJob2DTGadget</classname>

        <!-- parameters for debug and timing -->
        <property>
            <name>debugFolder</name>
            <value></value>
        </property>

        <property>
            <name>performTiming</name>
            <value>true</value>
        </property>

        <property>
            <name>verboseMode</name>
            <value>false</value>
        </property>

    </gadget>

</gadgetronStreamConfiguration>
