<?xml version="1.0" encoding="UTF-8"?>
<gadgetronStreamConfiguration xsi:schemaLocation="http://gadgetron.sf.net/gadgetron gadgetron.xsd"
        xmlns="http://gadgetron.sf.net/gadgetron"
        xmlns:xsi="http://www.w3.org/2001/XMLSchema-instance">
         

    <reader>
      <slot>1001</slot>
      <dll>gadgetroncore</dll>
      <classname>MRIAcquisitionReader</classname>
    </reader>

    <writer>
      <slot>1004</slot>
      <dll>gadgetroncore</dll>
      <classname>MRIImageWriterCPLX</classname>
    </writer>
    <writer>
      <slot>1005</slot>
      <dll>gadgetroncore</dll>
      <classname>MRIImageWriterFLOAT</classname>
    </writer>
    <writer>
      <slot>1006</slot>
      <dll>gadgetroncore</dll>
      <classname>MRIImageWriterUSHORT</classname>
    </writer>

    <gadget>
      <name>SpiralGadget</name>
      <dll>gadgetronspiral</dll>
      <classname>SpiralGadget</classname>
    </gadget>
    <gadget>
      <name>Extract</name>
      <dll>gadgetroncore</dll>
      <classname>ExtractGadget</classname>
      <!--
      <property><name>extract_mask</name><value>9</value></property>
      -->
    </gadget>

	<!--
    <gadget>
      <name>ImageWrite</name>
      <dll>gadgetroncore</dll>
      <classname>ImageWriterGadgetFLOAT</classname>
    </gadget>
    -->
    
    
    <gadget>
      <name>AutoScaleGadget</name>
      <dll>gadgetroncore</dll>
      <classname>AutoScaleGadget</classname>
   </gadget> 

   <gadget>
      <name>FloatToShort</name>
      <dll>gadgetroncore</dll>
      <classname>FloatToUShortGadget</classname>
    </gadget>
 
 	<!--
    <gadget>
      <name>ImageFinishCPLX</name>
      <dll>gadgetroncore</dll>
      <classname>ImageFinishGadgetCPLX</classname>
    </gadget>
    -->
    
    <gadget>
      <name>ImageFinishShort</name>
      <dll>gadgetroncore</dll>
      <classname>ImageFinishGadgetUSHORT</classname>
    </gadget>
    
 	<!--
    <gadget>
      <name>ImageFinishUSHORT</name>
      <dll>gadgetroncore</dll>
      <classname>ImageFinishGadgetUSHORT</classname>
    </gadget>
    -->

</gadgetronStreamConfiguration>
