<?xml version="1.0" encoding="UTF-8"?>
<gadgetronStreamConfiguration xsi:schemaLocation="http://gadgetron.sf.net/gadgetron gadgetron.xsd"
        xmlns="http://gadgetron.sf.net/gadgetron"
        xmlns:xsi="http://www.w3.org/2001/XMLSchema-instance">
        
    <reader>
      <slot>1008</slot>
      <dll>gadgetron_mricore</dll>
      <classname>GadgetIsmrmrdAcquisitionMessageReader</classname>
    </reader>
  
    <writer>
      <slot>1004</slot>
      <dll>gadgetron_mricore</dll>
      <classname>MRIImageWriterCPLX</classname>
    </writer>
    <writer>
      <slot>1005</slot>
      <dll>gadgetron_mricore</dll>
      <classname>MRIImageWriterFLOAT</classname>
    </writer>
    <writer>
      <slot>1006</slot>
      <dll>gadgetron_mricore</dll>
      <classname>MRIImageWriterUSHORT</classname>
    </writer>
  
    <gadget>
      <name>NoiseAdjust</name>
      <dll>gadgetron_mricore</dll>
      <classname>NoiseAdjustGadget</classname>
    </gadget>

    <gadget>
      <name>ReconX</name>
      <dll>gadgetron_epi</dll>
      <classname>EPIReconXGadget</classname>
    </gadget>

    <gadget>
      <name>Acc</name>
      <dll>gadgetron_mricore</dll>
      <classname>AccumulatorGadget</classname>
    </gadget>

    <gadget>
      <name>FFTYZ</name>
      <dll>gadgetron_epi</dll>
      <classname>FFTYZGadget</classname>
    </gadget>

   <gadget>
      <name>CoilCombinePython</name>
      <dll>gadgetron_python</dll>
      <classname>ImagePythonGadget</classname>
      <property><name>python_path</name>                  <value>/home/myuser/scripts/python</value></property>
      <property><name>python_module</name>                <value>rms_coil_combine</value></property>
      <property><name>gadget_reference_function</name>    <value>set_gadget_reference</value></property>
      <property><name>input_function</name>               <value>recon_function</value></property>
      <property><name>config_function</name>              <value>config_function</value></property>
    </gadget>

    <gadget>
      <name>Extract</name>
      <dll>gadgetron_mricore</dll>
      <classname>ExtractGadget</classname>
    </gadget>  
    <gadget>
      <name>ImageFinishFLOAT</name>
      <dll>gadgetron_mricore</dll>
      <classname>ImageFinishGadgetFLOAT</classname>
    </gadget>

</gadgetronStreamConfiguration>
