<?xml version="1.0" encoding="UTF-8"?>
<gadgetronStreamConfiguration xsi:schemaLocation="http://gadgetron.sf.net/gadgetron gadgetron.xsd"
    xmlns="http://gadgetron.sf.net/gadgetron"
    xmlns:xsi="http://www.w3.org/2001/XMLSchema-instance">

    <reader>
        <slot>1008</slot>
        <dll>gadgetron_mricore</dll>
        <classname>GadgetIsmrmrdAcquisitionMessageReader</classname>
    </reader>

    <writer>
        <slot>1012</slot>
        <dll>gadgetron_dicom</dll>
        <classname>DicomImageWriter</classname>
    </writer>

    <gadget>
        <name>Acc</name>
        <dll>gadgetron_mricore</dll>
        <classname>AccumulatorGadget</classname>
    </gadget>

    <gadget>
        <name>FFT</name>
        <dll>gadgetron_mricore</dll>
        <classname>FFTGadget</classname>
    </gadget>

    <gadget>
        <name>CoilCombinePython</name>
        <dll>gadgetron_python</dll>
        <classname>ImagePythonGadget</classname>
        <property><name>python_path</name>                  <value>/home/myuser/scripts/python</value></property>
        <property><name>python_module</name>                <value>rms_coil_combine</value></property>
        <property><name>gadget_reference_function</name>    <value>set_gadget_reference</value></property>
        <property><name>input_function</name>               <value>recon_function</value></property>
        <property><name>config_function</name>              <value>config_function</value></property>
    </gadget>

    <gadget>
        <name>Extract</name>
        <dll>gadgetron_mricore</dll>
        <classname>ExtractGadget</classname>
    </gadget>

    <gadget>
        <name>AutoScale</name>
        <dll>gadgetron_mricore</dll>
        <classname>AutoScaleGadget</classname>
    </gadget>

    <gadget>
        <name>DicomFinishFLOAT</name>
        <dll>gadgetron_dicom</dll>
        <classname>DicomFinishGadgetFLOAT</classname>
    </gadget>

</gadgetronStreamConfiguration>
