<?xml version="1.0" encoding="utf-8"?>
<gadgetronStreamConfiguration xsi:schemaLocation="http://gadgetron.sf.net/gadgetron gadgetron.xsd"
        xmlns="http://gadgetron.sf.net/gadgetron"
        xmlns:xsi="http://www.w3.org/2001/XMLSchema-instance">

    <!-- 
        GT Plus configuratin file for general 2D cartesian reconstruction using linear or non-linear SPIRIT
        The dual-layer cloud topology is used here, therefore every incoming SLICE is sent
        to one first layer GtPlus cloud node. This first layer node can further split the job and
        process the SLICE with one or more second layer nodes.

        This configuration file is for the first layer GtPlus cloud node.

        Author: Hui Xue
        Magnetic Resonance Technology Program
        National Heart, Lung and Blood Institute
        National Institutes of Health
        10 Center Drive, Bethesda
        MD 20814
        USA
        Email: hui.xue@nih.gov

        Ref to: 

        Hui Xue, Souheil Inati, Thomas Sangild Sorensen, Peter Kellman, Michael S. Hansen. 
        Distributed MRI Reconstruction using Gadgetron based Cloud Computing. 
        Magenetic Resonance in Medicine, doi: 10.1002/mrm.25213.
    -->

    <!-- reader -->
    <reader>
        <slot>1014</slot>
        <dll>gadgetronPlus</dll>
        <classname>GtPlus2DTGadgetCloudJobMessageReaderCPFL</classname>
    </reader>

    <!-- writer -->
    <writer>
        <slot>1014</slot>
        <dll>gadgetronPlus</dll>
        <classname>GtPlus2DTGadgetCloudJobMessageWriterCPFL</classname>
    </writer>

    <!--
    Recon computation for 2DT cases
    -->

    <gadget>
        <name>Recon</name>
        <dll>gadgetronPlus</dll>
        <classname>GtPlusReconJob2DTGadgetCloud</classname>

        <!-- parameters for kspace filter, image data -->
        <property>
            <name>filterRO</name>
            <value>Gaussian</value>
        </property>
        <property>
            <name>filterRO_sigma</name>
            <value>1.0</value>
        </property>
        <property>
            <name>filterRO_width</name>
            <value>0.15</value>
        </property>

        <property>
            <name>filterE1</name>
            <value>Gaussian</value>
        </property>
        <property>
            <name>filterE1_sigma</name>
            <value>1.0</value>
        </property>
        <property>
            <name>filterE1_width</name>
            <value>0.15</value>
        </property>

        <property>
            <name>filterE2</name>
            <value>Gaussian</value>
        </property>
        <property>
            <name>filterE2_sigma</name>
            <value>1.0</value>
        </property>
        <property>
            <name>filterE2_width</name>
            <value>0.15</value>
        </property>

        <!-- parameters for kspace filter, ref data -->
        <property>
            <name>filterRefRO</name>
            <value>Hanning</value>
        </property>
        <property>
            <name>filterRefRO_sigma</name>
            <value>1.5</value>
        </property>
        <property>
            <name>filterRefRO_width</name>
            <value>0.15</value>
        </property>

        <property>
            <name>filterRefE1</name>
            <value>Hanning</value>
        </property>
        <property>
            <name>filterRefE1_sigma</name>
            <value>1.5</value>
        </property>
        <property>
            <name>filterRefE1_width</name>
            <value>0.15</value>
        </property>

        <property>
            <name>filterRefE2</name>
            <value>Hanning</value>
        </property>
        <property>
            <name>filterRefE2_sigma</name>
            <value>1.5</value>
        </property>
        <property>
            <name>filterRefE2_width</name>
            <value>0.15</value>
        </property>

        <!-- parameters for kspace filter, partial fourier/asymmetric echo filter -->
        <property>
            <name>filterPartialFourierRO</name>
            <value>TaperedHanning</value>
        </property>
        <property>
            <name>filterPartialFourierRO_sigma</name>
            <value>1.5</value>
        </property>
        <property>
            <name>filterPartialFourierRO_width</name>
            <value>0.15</value>
        </property>
        <property>
            <name>filterPartialFourierRO_densityComp</name>
            <value>true</value>
        </property>

        <property>
            <name>filterPartialFourierE1</name>
            <value>TaperedHanning</value>
        </property>
        <property>
            <name>filterPartialFourierE1_sigma</name>
            <value>1.5</value>
        </property>
        <property>
            <name>filterPartialFourierE1_width</name>
            <value>0.15</value>
        </property>
        <property>
            <name>filterPartialFourierE1_densityComp</name>
            <value>true</value>
        </property>

        <property>
            <name>filterPartialFourierE2</name>
            <value>TaperedHanning</value>
        </property>
        <property>
            <name>filterPartialFourierE2_sigma</name>
            <value>1.5</value>
        </property>
        <property>
            <name>filterPartialFourierE2_width</name>
            <value>0.15</value>
        </property>
        <property>
            <name>filterPartialFourierE2_densityComp</name>
            <value>true</value>
        </property>

        <!-- parameters for recon job split -->
        <property>
            <name>job_split_by_S</name>
            <value>false</value>
        </property>
        <property>
            <name>job_num_of_N</name>
            <value>48</value>
        </property>
        <property>
            <name>job_max_Megabytes</name>
            <value>2048</value>
        </property>
        <property>
            <name>job_overlap</name>
            <value>1</value>
        </property>
        <property>
            <name>job_perform_on_control_node</name>
            <value>true</value>
        </property>

        <!-- parameters for the cloud computation 
             The cloud should be defined as the following: CloudNodeX_IP/Port/XMLConfiguration etc.
        -->
        <property><name>CloudComputing</name><value>false</value></property>
        <property><name>cloudNodeFile</name><value>myCloud_2DT_DualLayer_FirstLayer.txt</value></property>
        <property><name>CloudNodeXMLConfiguration</name><value>GT_2DT_Cartesian_CloudNode.xml</value></property>

        <!-- parameters for debug and timing -->
        <property>
            <name>debugFolder</name>
            <value></value>
        </property>

        <property>
            <name>debugFolder2</name>
            <value></value>
        </property>

        <property>
            <name>performTiming</name>
            <value>true</value>
        </property>

        <property>
            <name>verboseMode</name>
            <value>true</value>
        </property>

    </gadget>

</gadgetronStreamConfiguration>
