<?xml version="1.0" encoding="UTF-8"?>
<gadgetronStreamConfiguration xsi:schemaLocation="http://gadgetron.sf.net/gadgetron gadgetron.xsd"
        xmlns="http://gadgetron.sf.net/gadgetron"
        xmlns:xsi="http://www.w3.org/2001/XMLSchema-instance">
        
    <reader>
      <slot>1008</slot>
      <dll>gadgetron_core</dll>
      <classname>GadgetIsmrmrdAcquisitionMessageReader</classname>
    </reader>
 
    <writer>
      <slot>1004</slot>
      <dll>gadgetron_core</dll>
      <classname>MRIImageWriterCPLX</classname>
    </writer>
    <writer>
      <slot>1005</slot>
      <dll>gadgetron_core</dll>
      <classname>MRIImageWriterFLOAT</classname>
    </writer>
    <writer>
      <slot>1006</slot>
      <dll>gadgetron_core</dll>
      <classname>MRIImageWriterUSHORT</classname>
    </writer>

    <gadget>
      <name>Acc</name>
      <dll>gadgetron_core</dll>
      <classname>AccumulatorGadget</classname>
    </gadget>

    <gadget>
      <name>FFT</name>
      <dll>gadgetron_core</dll>
      <classname>FFTGadget</classname>
    </gadget>

    <gadget>
      <name>CropCombine</name>
      <dll>gadgetron_core</dll>
      <classname>CropAndCombineGadget</classname>
    </gadget>

    <gadget>
      <name>Extract</name>
      <dll>gadgetron_core</dll>
      <classname>ExtractGadget</classname>
    </gadget>

    <gadget>
      <name>AutoScale</name>
      <dll>gadgetron_core</dll>
      <classname>AutoScaleGadget</classname>
    </gadget>

    <gadget>
      <name>FloatToShort</name>
      <dll>gadgetron_core</dll>
      <classname>FloatToUShortGadget</classname>
    </gadget>
 
     <gadget>
      <name>ImageFinishUSHORT</name>
      <dll>gadgetron_core</dll>
      <classname>ImageFinishGadgetUSHORT</classname>
    </gadget>

</gadgetronStreamConfiguration>
