<?xml version="1.0" encoding="utf-8"?>
<gadgetronStreamConfiguration xsi:schemaLocation="http://gadgetron.sf.net/gadgetron gadgetron.xsd"
			      xmlns="http://gadgetron.sf.net/gadgetron"
			      xmlns:xsi="http://www.w3.org/2001/XMLSchema-instance">
  
  <reader>
    <slot>1008</slot>
    <dll>gadgetron_mricore</dll>
    <classname>GadgetIsmrmrdAcquisitionMessageReader</classname>
  </reader>
 
  <writer>
    <slot>1022</slot>
    <dll>gadgetron_mricore</dll>
    <classname>MRIImageWriter</classname>
  </writer>
<!--  
  <writer>
    <slot>1004</slot>
    <dll>gadgetron_mricore</dll>
    <classname>MRIImageWriterCPLX</classname>
  </writer>
  <writer>
    <slot>1005</slot>
    <dll>gadgetron_mricore</dll>
    <classname>MRIImageWriterFLOAT</classname>
  </writer>
  <writer>
    <slot>1006</slot>
    <dll>gadgetron_mricore</dll>
    <classname>MRIImageWriterUSHORT</classname>
  </writer>
-->
  <gadget>
    <name>NoiseAdjust</name>
    <dll>gadgetron_mricore</dll>
    <classname>NoiseAdjustGadget</classname>
  </gadget>
  
  <gadget>
    <name>PCA</name>
    <dll>gadgetron_mricore</dll>
    <classname>PCACoilGadget</classname>
  </gadget>
  
  <gadget>
    <name>CoilReduction</name>
    <dll>gadgetron_mricore</dll>
    <classname>CoilReductionGadget</classname>
    <property><name>coils_out</name><value>16</value></property>
  </gadget>
<!--
  <gadget>
    <name>SpiralToGenericGadget</name>
    <dll>gadgetron_spiral</dll>
    <classname>SpiralToGenericGadget</classname>
  </gadget>
-->

  <gadget>
    <name>SpiralOffResSets</name>
    <dll>gadgetron_spiral</dll>
    <classname>SpiralOffResSets</classname>
  </gadget>

  <gadget>
    <name>gpuGenericSensePrepGadgetRegrid</name>
    <dll>gadgetron_gpuparallelmri</dll>
    <classname>gpuGenericSensePrepGadgetRegrid</classname>
    <!-- <property><name>deviceno</name><value>0</value></property>
    <property><name>buffer_convolution_kernel_width</name><value>4.5</value></property>
    <property><name>buffer_convolution_oversampling_factor</name><value>1.25</value></property>
-->
  </gadget>

  <gadget>
    <name>SpiralOffResSubtract</name>
    <dll>gadgetron_spiral</dll>
    <classname>SpiralOffResSubtract</classname>
  </gadget>

<!--
  <gadget>
    <name>gpuCgSenseGadget</name>
    <dll>gadgetron_gpuparallelmri</dll>
    <classname>gpuCgSenseGadget</classname>
    <property><name>pass_on_undesired_data</name>  <value>true</value></property>
    <property><name>deviceno</name>                <value>0</value></property>
    <property><name>setno</name>                   <value>0</value></property>
    <property><name>number_of_iterations</name>    <value>1</value></property>
    <property><name>cg_limit</name>                <value>1e-6</value></property>
    <property><name>oversampling_factor</name>     <value>1.25</value></property>
    <property><name>kernel_width</name>            <value>4.5</value></property>
    <property><name>kappa</name>                   <value>0.3</value></property>
  </gadget>

  <gadget>
    <name>gpuCgSenseGadget</name>
    <dll>gadgetron_gpuparallelmri</dll>
    <classname>gpuCgSenseGadget</classname>
    <property><name>pass_on_undesired_data</name>  <value>true</value></property>
    <property><name>deviceno</name>                <value>0</value></property>
    <property><name>setno</name>                   <value>1</value></property>
    <property><name>number_of_iterations</name>    <value>5</value></property>
    <property><name>cg_limit</name>                <value>1e-6</value></property>
    <property><name>oversampling_factor</name>     <value>1.25</value></property>
    <property><name>kernel_width</name>            <value>4.5</value></property>
    <property><name>kappa</name>                   <value>0.3</value></property>
  </gadget>
-->
  <gadget>
    <name>Extract</name>
    <dll>gadgetron_mricore</dll>
    <classname>ExtractGadget</classname>
  </gadget>
  
  <!--
      <gadget>
      <name>ImageWrite</name>
      <dll>gadgetron_mricore</dll>
      <classname>ImageWriterGadgetFLOAT</classname>
      </gadget>
  -->    
  
  <gadget>
    <name>AutoScaleGadget</name>
    <dll>gadgetron_mricore</dll>
    <classname>AutoScaleGadget</classname>
  </gadget> 

  <gadget>
    <name>FloatToShort</name>
    <dll>gadgetron_mricore</dll>
    <classname>FloatToUShortGadget</classname>
  </gadget>
  
  <!--
      <gadget>
      <name>ImageFinishCPLX</name>
      <dll>gadgetron_mricore</dll>
      <classname>ImageFinishGadgetCPLX</classname>
      </gadget>
  -->
  
  <gadget>
    <name>ImageFinish</name>
    <dll>gadgetron_mricore</dll>
    <classname>ImageFinishGadget</classname>
  </gadget>    

</gadgetronStreamConfiguration>
