<?xml version="1.0" encoding="UTF-8"?>
<gadgetronStreamConfiguration xsi:schemaLocation="http://gadgetron.sf.net/gadgetron gadgetron.xsd"
        xmlns="http://gadgetron.sf.net/gadgetron"
        xmlns:xsi="http://www.w3.org/2001/XMLSchema-instance">
         
    <reader>
      <slot>1008</slot>
      <dll>gadgetron_mricore</dll>
      <classname>GadgetIsmrmrdAcquisitionMessageReader</classname>
    </reader>

    <writer>
      <slot>1004</slot>
      <dll>gadgetron_mricore</dll>
      <classname>MRIImageWriterCPLX</classname>
    </writer>
    <writer>
      <slot>1005</slot>
      <dll>gadgetron_mricore</dll>
      <classname>MRIImageWriterFLOAT</classname>
    </writer>
    <writer>
      <slot>1006</slot>
      <dll>gadgetron_mricore</dll>
      <classname>MRIImageWriterUSHORT</classname>
    </writer>

    <gadget>
      <name>NoiseAdj</name>
      <dll>gadgetron_python</dll>
      <classname>AcquisitionPythonGadget</classname>
      <property><name>python_module</name>                <value>tpat_snr_scale</value></property>
      <property><name>python_class</name>                <value>NoiseAdj</value></property>
    </gadget>

    <gadget>
      <name>RemOS</name>
      <dll>gadgetron_python</dll>
      <classname>AcquisitionPythonGadget</classname>
      <property><name>python_module</name>                <value>tpat_snr_scale</value></property>
      <property><name>python_class</name>                <value>RemOS</value></property>
    </gadget>

    <gadget>
      <name>PCA</name>
      <dll>gadgetron_python</dll>
      <classname>AcquisitionPythonGadget</classname>
      <property><name>python_module</name>                <value>tpat_snr_scale</value></property>
      <property><name>python_class</name>                <value>PCA</value></property>
    </gadget>

    <gadget>
      <name>CoilReduce</name>
      <dll>gadgetron_python</dll>
      <classname>AcquisitionPythonGadget</classname>
      <property><name>python_module</name>                <value>tpat_snr_scale</value></property>
      <property><name>python_class</name>                <value>CoilReduce</value></property>
    </gadget>

    <gadget>
      <name>Recon</name>
      <dll>gadgetron_python</dll>
      <classname>AcquisitionPythonGadget</classname>
      <property><name>python_module</name>                <value>tpat_snr_scale</value></property>
      <property><name>python_class</name>                <value>Recon</value></property>
    </gadget>

     <gadget>
      <name>Extract</name>
      <dll>gadgetron_mricore</dll>
      <classname>ExtractGadget</classname>
     </gadget>
  
    <gadget>
      <name>ImageFinishFLOAT</name>
      <dll>gadgetron_mricore</dll>
      <classname>ImageFinishGadgetFLOAT</classname>
    </gadget>

</gadgetronStreamConfiguration>
