<?xml version="1.0" encoding="UTF-8"?>
<gadgetronStreamConfiguration xsi:schemaLocation="http://gadgetron.sf.net/gadgetron gadgetron.xsd"
			      xmlns="http://gadgetron.sf.net/gadgetron"
			      xmlns:xsi="http://www.w3.org/2001/XMLSchema-instance">
  
  <reader>
    <slot>1008</slot>
    <dll>gadgetron_core</dll>
    <classname>GadgetIsmrmrdAcquisitionMessageReader</classname>
  </reader>
  
  <writer>
    <slot>1004</slot>
    <dll>gadgetron_core</dll>
    <classname>MRIImageWriterCPLX</classname>
  </writer>
  <writer>
    <slot>1005</slot>
    <dll>gadgetron_core</dll>
    <classname>MRIImageWriterFLOAT</classname>
  </writer>
  <writer>
    <slot>1006</slot>
    <dll>gadgetron_core</dll>
    <classname>MRIImageWriterUSHORT</classname>
  </writer>

  <gadget>
    <name>NoiseAdjust</name>
    <dll>gadgetron_core</dll>
    <classname>NoiseAdjustGadget</classname>
  </gadget>
  
  <gadget>
    <name>RemoveROOversampling</name>
    <dll>gadgetron_core</dll>
    <classname>RemoveROOversamplingGadget</classname>
  </gadget>

  <gadget>
    <name>gpuSpiralSensePrepGadget</name>
    <dll>gadgetron_gpuspiral</dll>
    <classname>gpuSpiralSensePrepGadget</classname>
    <property><name>deviceno</name><value>0</value></property>
    <property><name>use_multiframe_grouping</name><value>false</value></property>
  </gadget>
  
  <gadget>
    <name>gpuGpSenseGadget</name>
    <dll>gadgetron_gpusense</dll>
    <classname>gpuGpSenseGadget</classname>
    <property><name>deviceno</name>                <value>0</value></property>
    <property><name>number_of_iterations</name>    <value>50</value></property>
    <property><name>oversampling</name>            <value>1.25</value></property>
    <property><name>kernel_width</name>            <value>5.5</value></property>
    <property><name>lambda</name>                  <value>2.0e-7</value></property>
    <property><name>alpha</name>                   <value>0.5</value></property>
  </gadget>

  <gadget>
    <name>PhaseSubtraction</name>
    <dll>gadgetron_core</dll>
    <classname>FlowPhaseSubtractionGadget</classname>
  </gadget>
  
  <gadget>
    <name>Extract</name>
    <dll>gadgetron_core</dll>
    <classname>ExtractGadget</classname>
    <property><name>extract_mask</name><value>9</value></property>
  </gadget>
  
  <!--
      <gadget>
      <name>ImageWrite</name>
      <dll>gadgetron_core</dll>
      <classname>ImageWriterGadgetFLOAT</classname>
      </gadget>
  -->    
  
  <gadget>
    <name>AutoScaleGadget</name>
    <dll>gadgetron_core</dll>
    <classname>AutoScaleGadget</classname>
  </gadget> 

  <gadget>
    <name>FloatToShort</name>
    <dll>gadgetron_core</dll>
    <classname>FloatToUShortGadget</classname>
  </gadget>
  
  <!--
      <gadget>
      <name>ImageFinishCPLX</name>
      <dll>gadgetron_core</dll>
      <classname>ImageFinishGadgetCPLX</classname>
      </gadget>
  -->
  
  <gadget>
    <name>ImageFinishShort</name>
    <dll>gadgetron_core</dll>
    <classname>ImageFinishGadgetUSHORT</classname>
  </gadget>    

</gadgetronStreamConfiguration>
