<?xml version="1.0" encoding="UTF-8"?>
<gadgetronStreamConfiguration xsi:schemaLocation="http://gadgetron.sf.net/gadgetron gadgetron.xsd"
    xmlns="http://gadgetron.sf.net/gadgetron"
    xmlns:xsi="http://www.w3.org/2001/XMLSchema-instance">

    <reader>
        <slot>1008</slot>
        <dll>gadgetroncore</dll>
        <classname>GadgetIsmrmrdAcquisitionMessageReader</classname>
    </reader>

    <writer>
        <slot>1004</slot>
        <dll>gadgetroncore</dll>
        <classname>MRIImageWriterCPLX</classname>
    </writer>
    <writer>
        <slot>1005</slot>
        <dll>gadgetroncore</dll>
        <classname>MRIImageWriterFLOAT</classname>
    </writer>
    <writer>
        <slot>1006</slot>
        <dll>gadgetroncore</dll>
        <classname>MRIImageWriterUSHORT</classname>
    </writer>


<!--
    <gadget>
        <name>MatlabAcquisition</name>
        <dll>gadgetronmatlab</dll>
        <classname>AcquisitionMatlabGadget</classname>
-->
        <!--<property><name>path</name><value></value></property>-->
<!--
        <property><name>matlab_classname</name><value>scale</value></property>
    </gadget>
-->
    <!--
    <gadget>
        <name>Acc</name>
        <dll>gadgetroncore</dll>
        <classname>AccumulatorGadget</classname>
    </gadget>
    -->
    <gadget>
        <name>MatlabAcquisition</name>
        <dll>gadgetronmatlab</dll>
        <classname>AcquisitionMatlabGadget</classname>
        <property><name>matlab_classname</name><value>accumulate_and_recon</value></property>
    </gadget>
    <gadget>
      <name>FFT</name>
      <dll>gadgetroncore</dll>
      <classname>FFTGadget</classname>
    </gadget>
    <gadget>
      <name>CropCombine</name>
      <dll>gadgetroncore</dll>
      <classname>CropAndCombineGadget</classname>
    </gadget>
    <!--<gadget>
        <name>MatlabImage</name>
        <dll>gadgetronmatlab</dll>
        <classname>ImageMatlabGadget</classname>
        <property><name>matlab_classname</name><value>fft</value></property>
    </gadget>-->
    <gadget>
        <name>Extract</name>
        <dll>gadgetroncore</dll>
        <classname>ExtractGadget</classname>
    </gadget>
    <gadget>
        <name>ImageFinishFLOAT</name>
        <dll>gadgetroncore</dll>
        <classname>ImageFinishGadgetFLOAT</classname>
    </gadget>
</gadgetronStreamConfiguration>
